name,text
1605685265821044736,YouTube TV In Talks To Acquire NFL Sunday Ticket Rights https://t.co/pdbmOkReYj https://t.co/xoJqTm3LqJ
1605609454321508352,AMD Radeon RX 7900 XT Review: Should You Buy It? https://t.co/MxNMsj4ICW https://t.co/64sS2faAcA
1605594259498876933,New Google Leak Reveals Potentially Massive Pixel 8 Upgrade https://t.co/SRKjfLAc6M https://t.co/0KsDkCFpQY
1605579080547581954,$20 Million Funding For AI-Driven Microbiome-Based Therapeutics https://t.co/XNT4AJHDoM https://t.co/v1paVHzgmZ
1605563909951340545,"Pointedly Asking Generative AI ChatGPT About Whether Santa Claus Is Real Proves To Be Eye-Opening, Including For AI… https://t.co/W27MTMAna4"
1605503207232491520,How To Stop Windows 10 Crashing After Latest Security Update https://t.co/l28pA56vWS https://t.co/AeteWqMf5h
1605442578014519296,Washington Gridlock Will Put States At The Forefront Of Tech Policy In 2023 https://t.co/rFdki13kIL https://t.co/o9h4n6OjIG
1605347003378020352,"RT @alanohnsman: “Now if you're driving a Tesla, it's becoming: ‘let me see if I understand. There are options you had and you chose this o…"
1605321297810128897,"Heated Seats, BMW Subscriptions, And The Evolution Of Ownership In The Age Of Smart Matter https://t.co/LSuTkpY6ej https://t.co/acUB0FDS0N"
1605306138412597256,Netgear’s New And Affordable Wireless Access Point For Small Businesses https://t.co/q9bmh2SMVC https://t.co/mezgbOttHg
1605291026960338961,"Forget Your MacBook Pro, Apple Has Something Better https://t.co/oLYJODXLqM https://t.co/foPcTqBGY2"
1605275833278648321,AMD Radeon RX 7900 XTX Vs Nvidia RTX 4080: Which Should You Buy? https://t.co/a8NGc0EtnJ https://t.co/SrjPUg1pqD
1605260659150692357,10 AI Predictions For 2023 https://t.co/csgQr9ELIw https://t.co/kctthr0Wld
1605230244792762371,"Video-UVeye Demos Drive-Through Inspection Stations, Reveals EV’s Tire Issues https://t.co/KhoVekhcrn https://t.co/8vcmofxKJu"
1605215071499608065,Instagram Finally Adds The One Feature Everyone’s Requesting https://t.co/ganNwn2kaz https://t.co/g89tXAPs2A
1605199956708564993,EMEET S600 Webcam Delivers A Sharper Image And Privacy https://t.co/1cuP7VEQnc https://t.co/jHrWg8L1lw
1605139190542438400,How To Stop Windows 10 Crashing After Patch Tuesday Security Update https://t.co/i3VhlVoiKE https://t.co/prl533MuD6
1604987482633916417,"International Drug Conspiracy Used Binance To Launder Millions, DEA Investigation Finds https://t.co/FL8VgKMa5o https://t.co/3PxJ593Ggl"
1604957254549229582,The Pentagon’s $45 Billion 140 MHz Spectrum Blindspot https://t.co/ZjA21G3ujL https://t.co/xtXQRsWufD
1604942136708833300,SEC: Punishing Progress While Rewarding Confusion https://t.co/FbWLSsnRam https://t.co/96ld0SQHrP
1604896624412659717,Family Arriving For Christmas? Get The Tech Sorted Now https://t.co/JjbLLJJlj2 https://t.co/03yn1FdoGU
1604881534363881474,Qualcomm’s Snapdragon AR2 Is The World’s First Dedicated Platform For Lightweight Wireless AR Headsets… https://t.co/pIvZXMSeFb
1604790641795424256,"New Gmail Encrypted Email Feature Confirmed By Google, Will You Get It? https://t.co/EHH7PbAodX https://t.co/a1hp2KmzKp"
1604593429773787137,Elemental Machines Is Bringing The Internet Of Things To Lab Operations To Save Millions Of Dollars For Biotech Com… https://t.co/JMvwZNhbDj
1604578317595807744,Apple Leak Reveals Disappointing Mac Pro Cancellation https://t.co/nYLtPRLQx1 https://t.co/9onltdKmeo
1604563145183330305,Ugreen’s Compact Nexode Docking Station Is An Ideal Solution For Laptop Users https://t.co/dnvIgu7893 https://t.co/lIVbRCy9Gg
1604487395847577601,"Enraged Worries That Generative AI ChatGPT Spurs Students To Vastly Cheat When Writing Essays, Spawns Spellbound At… https://t.co/at1GPalIH9"
1604214393968812032,New Instagram Updates Bring Massive Changes https://t.co/vsh1s9bNxl https://t.co/c5bTYfYaBS
1604184167201136640,"Forget The MacBook Pro, Apple Has Something Better https://t.co/RpA68hiRey https://t.co/JElXkmrxHm"
1604168994620964864,Leak Unveils More Vintage Hi-Fi With Cutting-Edge Audio Technology https://t.co/G0l9D3IgHx https://t.co/2HlZdfnF1M
1604123470895280129,"A Fusion Power Milestone, A South Carolina Battery Plant And Fuel-Cell Powered Semis https://t.co/nLDahB3Mga https://t.co/oMFeoxHhqn"
1603865435732156417,"Apple Loop: Shock iPhone 15 Ultra Leak, Disappointing MacBook Air Delay, iPhone 14 Pro Is Missing… https://t.co/xsnlkT7S2m"
1603850327140274185,"Android Circuit: Galaxy S23 Details Confirmed, Xiaomi 13 Pro Launch, Overclock Your Pixel 6a https://t.co/iTjmLhqzOJ https://t.co/AWdd3MqPYS"
1603729181954789376,"Surveillance-For-Hire Industry Continues To Thrive, Says Meta https://t.co/kAmiuLifeV https://t.co/VR5Ay2KdjT"
1603641224467972096,"RT @cfarivar: Elon Musk Briefly Speaks To Reporters In Twitter Spaces, Then Departs (by @cfarivar)

https://t.co/0eN4Lj9GPR"
1603582079488360449,Astell&amp;Kern Launches First Portable Headphone Amplifier With Pure Class-A Technology https://t.co/nNFXQ6N6Q1 https://t.co/s3bFPVJJMB
1603491088416792601,AI Year-In-Review Roundup And Analysis Along With Pearls And Perils Entailing AI Ethics And AI Law… https://t.co/dl7ucvguf3
1603475974661804073,"Nikola And Plug Power Form Green Hydrogen, Fuel Cell Truck Supply Partnership https://t.co/Q6W9xJ3hZw https://t.co/Jy1IJ5R7Qk"
1603460815503429632,Ginkgo Has Hired A New Head Of Biopharma To Disrupt The Gene And Cell Therapies Market https://t.co/gEIIm1kRql https://t.co/DKw63vAySd
1603445559754473473,Want To Experience The Future Of Search? Go To https://t.co/kSKgxqzqfW https://t.co/QELJnuV4Fu https://t.co/rl3MVhi7ZE
1603442548663459842,RT @alanohnsman: Nikola and Plug Power are partnering on green hydrogen and Plug will also haul the carbon-free fuel using Nikola trucks #E…
1603430449094819841,What We Got Right And Wrong In Our 2022 AI Predictions https://t.co/TOs6g9tFMq https://t.co/0wEKUqrd0A
1603381472013991938,Drop Etymotic ERX Could Be The Most Exciting Pair Earphones You’ll Ever Hear https://t.co/tYYmb3BLeG https://t.co/J2XxVEOme5
1603366363644428289,"How To Get Twitter Verified On Mastodon, $8 Elon Musk Tax Not Required https://t.co/QEjnxqeBHP https://t.co/bQUk5EUc1P"
1603351167102320640,Ginkgo Has Hired A New Head Of Biopharma To Disrupt The Gene And Cell Therapies Market https://t.co/gEIIm1kRql https://t.co/htVAEGHvVl
1603136128667860993,"Cisco Appears On Track For Net Zero Emissions, Releases 2022 Purpose Report On Sustainability Goals… https://t.co/A4ZBZwft4P"
1603120871324979202,Ceridian Dayforce Wallet Provides Flexibility For Financially Stressed Employees https://t.co/1lnGncWncw https://t.co/mUwKaig0ya
1603060231277264896,Tesla Cofounder Aims To Rev Up U.S. EV Battery Market With $3.5 Billion South Carolina Plant https://t.co/0E6XaIKnwv https://t.co/FmX8D6vOgx
1603046490968010752,"RT @alanohnsman: Redwood Materials, created by Tesla cofounder JB Straubel, is building a $3.5 billion plant in South Carolina to scale up…"
1603045120827396097,Robotruck Converter SafeAI Lands Millions In New Funding https://t.co/YlRxXt2rHg https://t.co/8o421YV6Sn
1603029931772067841,"You Need To Fix Google Chrome’s Mojo, Here’s How &amp; Why https://t.co/F2Z1EaSpAU https://t.co/kpwF222Md2"
1603014707698434048,Meta Sued For Billions Over Incitement To Violence In Ethiopia https://t.co/LyCMrNhezp https://t.co/p5auYevRpL
1602999594920644616,"Amazon’s New Fire TV Cube Offers Smoother Streaming, More Inputs And Snappier Performance https://t.co/dZGqovu2GV https://t.co/r3pDpsO4Ga"
1602984363838390273,Honor Magic Vs Preview: Folding A New Flagship For Europe https://t.co/24xCTS3t6d https://t.co/iTJJBjHeKP
1602969162208477185,Windows 10 And 11 Security Feature Alerts Bypassed By Attackers https://t.co/eQol4pf1uP https://t.co/0TocP0THIi
1602847834256072705,MIPS Joins The RISC-V Gang https://t.co/R3M4BJWpso https://t.co/zs2P5DcjTm
1602832734963093506,IBM And Rapidus Will Collaborate To Build 2nm Chips In Japan. https://t.co/ZPe9k7Okaf https://t.co/TOZLNIxHnz
1602817612525830145,Sam Bankman-Fried Is Denied Bail And Jailed Until February https://t.co/nP1bjxmYoY https://t.co/jq1qNWemVL
1602802437638742016,Ampere’s Data Center Penetration Shows Cloud Software Platforms Perform Best On Cloud Native Processors… https://t.co/AALtoWgBvH
1602787264790241281,Xiaomi Surprises With New Phone And Router Launch Featuring Qualcomm Wi-Fi 7 Chipsets https://t.co/qZjZj3uphG https://t.co/pyGFfyOHBz
1602772152989716486,Remote Online Notarization Is Key To Improving Government Efficiency https://t.co/sbHy2G8QAB https://t.co/hdjZjiUgVC
1602756987254878210,Qualcomm Unveils Its High-Speed Wi-Fi 7 Wireless Technology For Home Users https://t.co/vWww8Wdoqj https://t.co/9Fus4myTLw
1602741862447869952,Apple Releases iOS 16.2: Key iPhone Update With Stunning Features https://t.co/FGUE6y0M7X https://t.co/RoTmkF9k6u
1602696403427512323,Biodiversity Makes Good Business: Basecamp Research Just Raised $20 Million To Build A Database Of All Life… https://t.co/3dmGRxmTls
1602681160240447491,"Digging Into The Buzz And Fanfare Over Generative AI ChatGPT, Including Looming AI Ethics And AI Law Considerations… https://t.co/7oXobCtCls"
1602666046799941632,First-Ever AI Video Platform Integrating Text-Generated Image And Animation https://t.co/n6ws0B9RSO https://t.co/ydobLq6Ws6
1602650871715749889,"Arcimoto, Faction, GoCar Partner For Three-Wheel Robo Tour Cars https://t.co/q9zkGqr5np https://t.co/ACairvmrY6"
1602635759248441344,Tronsmart Reveals Wireless Bang SE Party Speaker In Time For Christmas https://t.co/s2DZxguHzc https://t.co/JCT1ddMMQ1
1602620600769548289,Apple’s Game-Changing iPhone 14 Feature Gets Even Better From Today https://t.co/Md3gEN9A1E https://t.co/2kEMr3od6h
1602605485131169794,"As ESG Is Gamed With Greenwashing, Better Energy Uses Future Fit. https://t.co/7TsLycntia https://t.co/ZPaJdisXH2"
1602514362715062275,Japan’s New Semiconductor Foundry Rapidus Taps IBM For 2nm Process https://t.co/XMDon4l6s7 https://t.co/rApAwSiLT0
1602423437544267777,Radeon RX 7900 Series Benchmarks Show AMD Bringing The Fight To NVIDIA https://t.co/p00TSJZYP1 https://t.co/U3r4uf42Be
1602408262720458752,"Scott Belsky: Adobe VP Talks AI, Creativity And Superpowers https://t.co/azXaDGhXHV https://t.co/EhjMvLy1xy"
1602393105335975937,New MacBook Air Leak Reveals Apple’s Stunning Upgrade https://t.co/55GCDpojvz https://t.co/iYiJkMaot7
1602377993766182912,"Ventana Micro Launches Server-Class RISC-V CPU, Challenging Arm https://t.co/zOJoOe8VtD https://t.co/Jj4u6sZJZC"
1602332520909049857,LG Launches World’s First 240Hz OLED Gaming Monitors https://t.co/7f00970nvY https://t.co/ynOEqs5isr
1602317407929991168,"Emerging Rise Of “AI Localism” Is Getting Bigger, Bolder, And Badder Says AI Ethics And AI Law… https://t.co/zszQRYOp4V"
1602302230111162369,"Elite Hackers Made Almost $1 Million Last Week, Here’s How https://t.co/q74Fvp7LfW https://t.co/wEhBvKJezB"
1602287179480399875,When Net Neutrality Blocks End Users From Freely Learning Online https://t.co/R8ixozTSFq https://t.co/OIq9L510vG
1602271939783004162,Grado’s Redesigned Prestige SR60x Open-Back Headphones Are Simply Superb https://t.co/xGG2fcqAUx https://t.co/ukxjYck55I
1602044293056794628,"E-commerce Bots Boosting Prices, Causing Shortages, And Taking Advantage Of Crises https://t.co/sGb9QMYMZW https://t.co/xjaWF2SbWN"
1602029180522270723,Google Improves Privacy Of Google Photos But Makes Key Feature Worse https://t.co/9fKM3zpaon https://t.co/YJK2JpsZXP
1601938252205785088,These Rosewood Oriole Headphones From SIVGA Could Be The Best You’ve Ever Heard https://t.co/yLLvfdEJt5 https://t.co/t2lJcOVDGU
1601725801170444288,Twitter Blue Launches Monday: Here’s What’s Included https://t.co/DMuGuyGLQO https://t.co/JflctBHs52
1601649983798890496,Apple’s Shock MacBook Pro Decision https://t.co/pscQG8fpq9 https://t.co/oC1yhyESLM
1601589282644295681,"ESG Efforts Ramp Up, Tesla Semis Hit The Road And Reaping Billions From Clean Energy Bonds https://t.co/fpxqmZsN3U https://t.co/wLWGeiZfij"
1601558852452945921,Recharge Your iPhone With These Two Handy Power Banks From iWALK https://t.co/cLKtjUthNN https://t.co/cFrLthvoDw
1601376841981468672,Right Now In Tech: AWS re:Invent 2022 https://t.co/pM0dVOL6vi https://t.co/8UHAUXsT3x
1601361667551551496,"Android Circuit: Massive Pixel Fold Leaks, iQOO 11 Pro Launch, Thunderbird Development Continues… https://t.co/kjiTKBJ3AX"
1601346453510692865,"In New Recordings, Former Georgian President And Putin Foe Alleges Abuse Amid Claims He Is Being Poisoned… https://t.co/OWfF0ojsTD"
1601331296239849473,Nations Trading Their AI As Geopolitical Bargaining Chips Raises Angst For AI Ethics And AI Law… https://t.co/2jsnRULrNH
1601316102566551553,Apple Music Sing: New iPhone Feature Revealed For The Ultimate Singalong https://t.co/esCEoPEsdk https://t.co/QuBFJYzJ83
1601300990765965369,"Apple Loop: iPhone 15 Ultra Leaks, Unexpected iPad Detail, iPhone 14 Pro’s Christmas Disappointment… https://t.co/3IAigqGXh2"
1601285815564369925,How Musk Made Vivaldi Build A Mastodon Server... In A Fortnight https://t.co/TsbMRRDd8m https://t.co/k4Bq6KnO5c
1601265350116622339,Right Now In Tech: AWS re:Invent 2022 https://t.co/pM0dVOL6vi https://t.co/HAR6pezol1
1601250190006034432,House Of Marley’s Get Together 2 Speakers Are Made With Recycled Materials And Look Superb https://t.co/MhMG4C0BYd https://t.co/oVXfzcvPV1
1601234934953385988,Working With AI Today As A Guide To The Future Of Work https://t.co/QYdXgY91qP https://t.co/gr7POHUGv3
1601219758531219457,Nations Trading Their AI As Geopolitical Bargaining Chips Raises Angst For AI Ethics And AI Law… https://t.co/KcXgeXyTzt
1601204645371813888,"Amazon, Ashton Kutcher And America’s Surveillance Of The Sex Trade https://t.co/zbRrbtaL3y https://t.co/4UQaphmIRu"
1601189487526252545,How Musk Made Vivaldi Build A Mastodon Server... In A Fortnight https://t.co/TsbMRRDd8m https://t.co/YKyQ4zhlin
1601174294914007040,"Apple Expands ICloud Encryption, Moves Away From Client-Side Scanning https://t.co/Jz9ZZFLqDk https://t.co/uQa8xse1Wz"
1601007604871880705,GM’s Mary Barra Confident Of Complete Consumer EV Conversion https://t.co/7NV2C4tjqA https://t.co/5ELTtlizNs
1600977387084304398,AWS Advances Financial Services In The Cloud: News From Re:Invent 2022 https://t.co/M4enKD22Cn https://t.co/xBN06j0vx8
1600947018175758337,"Audeze Reveals Maxwell... A Low-Latency Gaming Headset For Playstation, Xbox And PCs https://t.co/U9l7zvglHY https://t.co/6v5yvl9SjW"
1600916796793655307,Apple iOS 16.2: Apple’s Controversial New iPhone Update Is Almost Here https://t.co/pkYefQyaOJ https://t.co/RqVXqRdssg
1600907105745227776,Meze Audio Announces Limited-Edition Epoque To Its Art Gallery Headphone Collection https://t.co/xBO1mfzuQK https://t.co/YFtiRvORZz
1600891994741608449,Analysts Predictions About AI In 2023 https://t.co/fgZF1KsNoU https://t.co/pD4j8vbEiB
1600876866440667138,ExpressVPN Launches Aircove Router https://t.co/BmrobuI9Ju https://t.co/qJCHDC6VAa
1600861561647775746,Bowers &amp; Wilkins And McLaren Create Limited-Edition Version Of B&amp;W Px8 Headphones https://t.co/z7kbFHRRLa https://t.co/VuGAUHlOMB
1600846448429617154,Apple iOS 16.2: Apple’s Controversial New iPhone Update Is Almost Here https://t.co/pkYefQyaOJ https://t.co/NKkvfNSBdg
1600831209059278848,Can Calling *#21# Reveal FBI iPhone Wiretap? https://t.co/Ogx2siVIVO https://t.co/FpG7Aupxf7
1600800855002841090,Amazon Echo Show 15 Owners Get A Big Free Upgrade https://t.co/Mm3QWrCjSA https://t.co/KXnUSU2FBK
1600755248498368512,How Laurel Bowden Became One Of Europe’s Top Investors By Skipping The Hype https://t.co/GHDrTgZ0tL https://t.co/ac6JwL0sJa
1600740070969032704,How This European VC Landed A $2.6 Billion Windfall From Adobe’s Figma Takeover https://t.co/uEnp0I0tCz https://t.co/SgNOaFQYSH
1600694548509986820,New Instagram Update Reveals The Secret Reasons Your Posts Aren’t Being Seen https://t.co/3p8XD1ro3G https://t.co/QOYkxphZU7
1600649151364141056,Should Meta Build A New Twitter? Yes ... But Also So Much More https://t.co/eG5SxNEVdc https://t.co/0R4vtXgwTC
1600633992134508549,Campfire Audio’s Superb Orbit Are The Brand’s First True Wireless Earbuds https://t.co/QzE7THEY0F https://t.co/1IYdfRROZp
1600618802949005315,Elon Musk Wanted Twitter To Encrypt Messages. His New Safety Chief Says It’s On Hold https://t.co/aow1F28MGQ https://t.co/On6xNUkHe7
1600603607828729989,IBM On Track To Achieve Quantum Advantage By 2026 Using Error Mitigation https://t.co/HKXsmiTjZW https://t.co/xTtp23knOe
1600588428579688450,Farmer’s Fridge: Meet The Vending Machines That Provide Farm-To-Fridge Freshness With Waste-Reducing Technology… https://t.co/pCJk1HGhEj
1600573271170236437,AI Shake-Up As Prominent AI Guru Proposes Mind-Bending “Mortal Computers” Which Also Gets AI Ethics And AI Law Dug… https://t.co/qW21LtqAwg
1600558076653932545,Google Implements Smart Google Photos App Change https://t.co/HnikpkBG7m https://t.co/EqSQWPSiBL
1600542901917962241,Is Commerce Getting Played By The Chinese Government On Export Controls? https://t.co/BotIuM7LW1 https://t.co/CaGobEirrb
1600527788854894596,Zero-Day Hackers Breach Samsung Galaxy S22 Twice In 24 Hours https://t.co/lGTv4iL0Ya https://t.co/Q8KMRkm03A
1600512611350679553,Piiano Releases Secure Database For Enterprises And Developers https://t.co/2SU300qCyh https://t.co/qFph74EnXA
1600497451974238209,AZIO’s New Cascade 98 Keyboard Has Just Launched With A Choice Of Slim Or Standard Sizes https://t.co/N1qHZy8fKt https://t.co/LjB7gpcEON
1600482197408043008,Vivaldi Builds Mastodon Into Web Browser https://t.co/m0ZlJkrpbR https://t.co/TtvlgAHa65
1600467085330636800,"Einride Bucks Tide, Wins Half-Billion Financing https://t.co/qfSIZ2TPWW https://t.co/oNrbjf9vzY"
1600376126903386112,Funding For Europe’s Startups Stalls As Its Tech Industry Slows Down https://t.co/CjCszaKpCX https://t.co/ts7foCRzbe
1600224476762935301,Apple Music Sing: New iPhone Feature Revealed For The Ultimate Singalong https://t.co/N1uXcVAdmN https://t.co/WHnRMNcd3K
1600209306506432517,Want A Biotech Lab? This Start Up Is Revolutionizing The Bioeconomy With On Demand Lab Space.… https://t.co/3S0gd6fT2m
1600163776858406917,Robot Truck Startup Kodiak Gets A $50 Million Chance To Adapt Its Tech For The U.S. Army https://t.co/fPda3l76zi https://t.co/d6K7grApUO
1600148667666759682,Carputty Wins Investor Millions To Dull Auto Financing Pain Points https://t.co/e18bP9KC8G https://t.co/vtOktz6YcD
1600134312812490752,RT @alanohnsman: Kodiak gets a $50 million chance to adapt its robot truck tech for the U.S. Army #autonomousvehicles via @forbes https://t…
1600133476203773953,Rezonate Launches Identity Protection Platform For Cloud Infrastructure https://t.co/StPuQMfQFC https://t.co/tIpJHUvfnF
1600118239878594560,Netgear’s New Orbi 860 Series Is The Ultimate Wi-Fi 6 Home Mesh System https://t.co/Tm7cCMVi4O https://t.co/MMxIKh9s0w
1600103081647251456,Security Expert Warns ‘Update Google Chrome Now’ As CISA 0Day Deadline Revealed https://t.co/1ViwmA4Ejt https://t.co/oWQXMHfxuo
1600072780438962178,The Beosound Theatre Is A Monster Soundbar But Size Comes At A Price https://t.co/TitIim6L87 https://t.co/jKMsryf05v
1599951427929100289,Cerebras Announces Pay-As-You-Go AI Training On Cirrascale Cloud https://t.co/bWRQbogPOA https://t.co/SlTXtYJMTp
1599936252589051905,"Astell&amp;Kern Reveals The New HC3… A Luxury, Lightweight Headphone DAC https://t.co/Va0TTJLA2l https://t.co/SweMRaLsZp"
1599905982796251137,Sky Glass Picture Upgrade Starts Rolling Out Tonight https://t.co/9jfYGuKfz3 https://t.co/7tjE0Hfs8c
1599890794613202944,Runway Raises $50 Million At $500 Million Valuation As Generative AI Craze Continues https://t.co/IxnV3Qm5xG https://t.co/4mQIBQLuS3
1599830095212036103,"Forget The MacBook Pro, Apple Has Something Much Better https://t.co/obzZNfSTp7 https://t.co/2rW72XDQsz"
1599799809556316160,Nothing Is Free: Contrarian Thoughts On Broadband Policy https://t.co/4k1ICXMW9h https://t.co/QI4yJrQING
1599784633037717504,TCL Launches New QLED Roku TVs In The UK https://t.co/CSCAFyd2AG https://t.co/1rBOGpI5Bz
1599739107609042945,Audient’s EVO 4 Audio Interface Is The Perfect Christmas Gift For Your Budding Musician https://t.co/qcOdhNPzEZ https://t.co/F1NYNLlnxf
1599648207960788992,How To Reboot Climate Policy After COP27: Five Models Of Policy Making https://t.co/YUGfLv5f2u https://t.co/Z5iKBVi96y
1599533627804913664,"RT @TheAlexKnapp: In this week's edition of the Current Climate newsletter, ⁦⁦@alanohnsman⁩ and I look at the ups and downs of a clean ener…"
1599533404378497024,RT @alanohnsman: The Tesla Semi is finally here but there’s a lot we don’t know — including its cost and weight 🤷🏽‍♂️ #ElectricVehicles via…
1599496420645650439,Pixel Watch Review: The Time Is Not Quite Right For Google’s Smartwatch https://t.co/6R1H6xFa8Y https://t.co/lu6VmLFFRN
1599466199846371334,Apple iPhone 14 Pro: How Recent iPhones Have A Cute Secret Feature https://t.co/zazpXrWbmG https://t.co/1irYEEXnvR
1599405502345236482,Massively Brewing “Trust Recession” Aims To Erode Responsible AI Says AI Ethics And AI Law https://t.co/R1iqx3rkTs https://t.co/b65RMRC9Pm
1599390386832695299,Apple’s Amazing New iPhone 14 Feature May Already Have Saved A Life https://t.co/QNIxOnmkAl https://t.co/OuZKNhNEvU
1599375197412491265,TP-Link Deco PX50 Is The Perfect Mesh Network For Larger Homes And Thick Walls https://t.co/a19WdJWlIA https://t.co/JKfRlN7Avd
1599360083644878848,Why You Must Force Update Google Chrome Now: New 0Day Threat Confirmed https://t.co/igs2A5vVVp https://t.co/FeHHox67EF
1599132834568044567,Apple iPad 2022: New Report Uncovers Tablet’s Big Drawback https://t.co/nXEm5u3rG7 https://t.co/3sbTo7qphI
1599057197564141574,Classic British Brand Mission Unveils First Amplifier In 40 Years https://t.co/pfGB6iFLtQ https://t.co/spjsraBj8E
1599042021427232768,"A Clean Energy Fund’s Challenges, How Twitter Antics Hurt Tesla’s Brand And 30 Under 30 Innovators… https://t.co/5ezzomNVFm"
1599011610437230592,Raycast: The Free App That Every Mac Owner Should Install Now https://t.co/bz5o8RNAdp https://t.co/w9Vo96INpp
1598845054361165824,Web3 Antivirus Launches To ‘Save Billions’ In Crypto And Smart Contract Fraud https://t.co/kcESDEW88d https://t.co/L7t0SePTqC
1598829879553835008,"Apple Loop: IPhone 15 Ultra Leaks, A Glass MacBook, App Store’s Crypto Problem https://t.co/QaBr4urdgc https://t.co/GipXekInaI"
1598814769347166210,"Android Circuit: Pixel 7a Leaks, Galaxy Flip 5 Details, The Fall Of Huawei https://t.co/QABCMc70NQ https://t.co/MudmbqtZcf"
1598769385715400704,Apple’s Coolest iPhone Feature Now Available To Google Pixel Users https://t.co/DTd9jZ34l7 https://t.co/n9B4oFGwpH
1598754198807629824,"If You Have Apple AirPods, You Need This Neat New Belkin Accessory https://t.co/FUAYuUyoQH https://t.co/9muhEFh4Hh"
1598739024604176384,Ukraine’s Belight Software Gets A Move-On By Giving Art Text 4 An Animation Update https://t.co/78hAsNkXdw https://t.co/5xFTDvMYDO
1598723850489008128,OTT Regulation And Digital Accessibility Center Stage At 5G Techritory 2022 https://t.co/FVgYFBeAGK https://t.co/7bbTaX0c8f
1598708614352478209,Elon Musk’s Twitter Antics Are Tarnishing Tesla – Just As Its EV Rivals Are Catching Up https://t.co/sUijXVbGAT https://t.co/VEUNnIp63O
1598693502816247808,Loupedeck Reveals Live S – Its Most Compact And Affordable Console Yet https://t.co/KyIU0P1X8W https://t.co/gOVvNLMDYL
1598693462677000197,"RT @alanohnsman: “I think if you’re a senior leader at Tesla, you’re praying and hoping that either Elon changes focus or gets off this Twi…"
1598678394115432451,Supercharge Your Headphones With iFi’s New GO Link Portable DAC https://t.co/liZE6WdVcT https://t.co/0wsYz6PlNF
1598663154338242560,I Interviewed An AI About The Ethics Of AI - And It Lied To Me https://t.co/JBxlbll3lp https://t.co/oKnPQWqe9k
1598648041917005824,RCA Launches New Roku TVs In The UK https://t.co/933jBdTmM9 https://t.co/wwtyUZzeql
1598572413100466176,Rotel Announces Its New S14 All-In-One Streaming Amplifier https://t.co/hWf0QS2ieT https://t.co/j54tVpgfaK
1598451190781693977,"645 Ventures, Which Brought A Growth Playbook To Early-Stage VC, Launches A Growth Fund https://t.co/NnUjwo9q6m https://t.co/YZAlMiTnV2"
1598435952367751189,The FTX Fallout Exposes Risky Rigamarole Of Registration https://t.co/hBiQqllsWW https://t.co/a5GyJ700Hu
1598420841724796928,Navier To Unveil First U.S. Electric Hydrofoil https://t.co/DmEWpX6gca https://t.co/EUWC8OAgKa
1598405603709386823,Apple’s New Coinbase NFT Shakedown Would Literally Tax Ethereum Trades And Transfers On iOS https://t.co/pRS9k3C1sI https://t.co/ofZAgeAYvg
1598390426301566978,Implanting Legal Reasoning Into AI Could Smartly Attain Human-Value Alignment Says AI Ethics And AI Law… https://t.co/ToMdx3aoGS
1598375318934458368,Constellation Brands Goes Green With Delivery Of First Monarch Electric Tractors https://t.co/8WT17tn2yQ https://t.co/23jSJKmQGL
1598360140905865220,"Cops Can Extract Data From 10,000 Different Car Models’ Infotainment Systems https://t.co/LgfqleGUN5 https://t.co/vIoeqVTprt"
1598344903527989248,Apple iOS 16.1.2: Surprise iPhone Release With Crucial Upgrades https://t.co/0ZlQajPSg9 https://t.co/p1R3LfbqMM
1598329729299406848,Holiday Gift Guide 2022: Some Cool Ideas For That Special Cannabis Fan https://t.co/hii47PorfG https://t.co/i8uM4YjKu6
1598314552642469890,New LastPass Hack Confirmed—Here’s What We Know So Far https://t.co/HyVUpBg9YL https://t.co/lgk0QgsRsj
