name,text1598299330183675905,T+A’s New Solitaire T Headphones Offer Great Passive And Wireless Performance With ANC https://t.co/C9POAKOLwC https://t.co/Sr7jxnPTCO
1598284143485394949,Cleer Sets The Scene By Revealing Its First Bluetooth Wireless Speaker https://t.co/QWlbCToJd5 https://t.co/U0JXkC0yri
1598193141068316672,Disney Developed An AI Tool That Can Make Actors Look Younger On Video With Just One Click https://t.co/nOAoGbFcQQ https://t.co/1NJsVL64C4
1598132504766070786,YouTube Apps Are Currently Crashing For Thousands Of Users https://t.co/aKgsKhuyMf https://t.co/ZIwaAgbU8k
1598117282621915137,Why You Need To Be Using Fake Data https://t.co/ZyGG1Y89dx https://t.co/amwMQ6vnwp
1598102093608484867,"State Of AI, December 2022 https://t.co/AMWRCLQz6E https://t.co/ryFM1OavdZ"
1598086918864080902,OnePlus Promises Remarkable Phone Innovations In 2023 https://t.co/CZVIv41aYg https://t.co/0zZpbVp3U7
1598071810213511185,Campfire Audio Reveals Luxurious Limited-Edition Trifecta Earphones https://t.co/snamdynjBY https://t.co/HataYjktio
1598056586810884097,NZXT H5 Elite Review: The Perfect Case For Your Gaming PC? https://t.co/2nkacA2gOr https://t.co/B6pfSNXUoy
1598041394878287890,"Many American Workers Are Suffering, But Not Those In Not Freight Rail https://t.co/5461A3zmwY https://t.co/tyf1QVQl6c"
1598026284533170176,Intel Core i7-13700K Vs AMD Ryzen 9 7900X: Which Should You Buy? https://t.co/ejbmjmS44T https://t.co/afAiwmaRGA
1597983040831201281,Campfire Audio Reveals Luxurious Limited-Edition Trifecta Earphones https://t.co/snamdynjBY https://t.co/tJESjSk5qm
1597967853172432896,Sibros Goes On E.Go Trip With German Urban EV Company https://t.co/RUKsTrANw6 https://t.co/DNu1W1oPKU
1597952724687003648,OnePlus Confirms Extensive Oxygen OS Support And Updates https://t.co/IYuiYjTnuy https://t.co/33Zwpt7iJR
1597937619870142464,Asus ROG Strix X670E-I Gaming WiFi Review: The Best Ryzen 7000 Mini-ITX Motherboard? https://t.co/8idvmI7VZu https://t.co/OVCS3lAmd0
1597846536825831424,Ria Health Launches Platform To Manage Alcohol Use Disorder https://t.co/eYdV0VbqNk https://t.co/7r0JVsZJ0t
1597816251342004225,"iCAD To License, Commercialize  Google Health Breast Cancer Detection AI https://t.co/EiacFfD5VE https://t.co/3pFmok4PGA"
